"DESCRIPTION","DURATION IN MS","NAME","PARENT SUITE","START TIME","STATUS","STOP TIME","SUB SUITE","SUITE","TEST CLASS","TEST METHOD"
"","2310","Example #1","firefox","2025-12-28","failed","2025-12-28","Login Functionality > Successful login with valid credentials","","",""
"","1134","Unsuccessful login with invalid credentials","firefox","2025-12-28","failed","2025-12-28","Login Functionality","","",""
"","65","Update a webhook using PUT","firefox","2025-12-28","failed","2025-12-28","Webhook API","","",""
"","59","Delete a webhook using DELETE","firefox","2025-12-28","failed","2025-12-28","Webhook API","","",""
"","65","Create a new webhook using POST","firefox","2025-12-28","failed","2025-12-28","Webhook API","","",""
"","61","Retrieve and then delete a webhook","firefox","2025-12-28","failed","2025-12-28","Webhook API","","",""
"","60","Retrieve a webhook using GET","firefox","2025-12-28","failed","2025-12-28","Webhook API","","",""
