"DESCRIPTION","DURATION IN MS","NAME","PARENT SUITE","START TIME","STATUS","STOP TIME","SUB SUITE","SUITE","TEST CLASS","TEST METHOD"
"","157","Retrieve an existing user","firefox","2025-12-24","failed","2025-12-24","User API Endpoints","","",""
"","255","Delete an existing user","firefox","2025-12-24","failed","2025-12-24","User API Endpoints","","",""
"","179","Update an existing user","firefox","2025-12-24","failed","2025-12-24","User API Endpoints","","",""
"","177","Create a new user","firefox","2025-12-24","failed","2025-12-24","User API Endpoints","","",""
"","1258","Unsuccessful login with invalid credentials","firefox","2025-12-24","failed","2025-12-24","Login Functionality","","",""
"","1499","Example #1","firefox","2025-12-24","failed","2025-12-24","Login Functionality > Successful login with valid credentials","","",""
