"DESCRIPTION","DURATION IN MS","NAME","PARENT SUITE","START TIME","STATUS","STOP TIME","SUB SUITE","SUITE","TEST CLASS","TEST METHOD"
"","160","Create a new user","chromium","2025-12-24","failed","2025-12-24","User API Endpoints","","",""
"","295","Example #1","chromium","2025-12-24","failed","2025-12-24","Login Functionality > Successful login with valid credentials","","",""
"","159","Delete an existing user","chromium","2025-12-24","failed","2025-12-24","User API Endpoints","","",""
"","283","Unsuccessful login with invalid credentials","chromium","2025-12-24","failed","2025-12-24","Login Functionality","","",""
"","254","Update an existing user","chromium","2025-12-24","failed","2025-12-24","User API Endpoints","","",""
"","155","Retrieve an existing user","chromium","2025-12-24","failed","2025-12-24","User API Endpoints","","",""
