"DESCRIPTION","DURATION IN MS","NAME","PARENT SUITE","START TIME","STATUS","STOP TIME","SUB SUITE","SUITE","TEST CLASS","TEST METHOD"
"","65","Retrieve and then delete a webhook","chromium","2025-12-26","failed","2025-12-26","Webhook API","","",""
"","287","Unsuccessful login with invalid credentials","chromium","2025-12-26","failed","2025-12-26","Login Functionality","","",""
"","65","Update a webhook using PUT","chromium","2025-12-26","failed","2025-12-26","Webhook API","","",""
"","66","Retrieve a webhook using GET","chromium","2025-12-26","failed","2025-12-26","Webhook API","","",""
"","621","Example #1","chromium","2025-12-26","failed","2025-12-26","Login Functionality > Successful login with valid credentials","","",""
"","65","Delete a webhook using DELETE","chromium","2025-12-26","failed","2025-12-26","Webhook API","","",""
"","64","Create a new webhook using POST","chromium","2025-12-26","failed","2025-12-26","Webhook API","","",""
